{
  "schema": "meshcore.irb.improvement.v1",
  "run": {
    "job_id": "",
    "timestamp_utc": "2026-02-18T20:20:49Z",
    "commit_range": null,
    "forced": true,
    "irb_force": true,
    "irb_surfaces": [
      "governance",
      "ops-scripts"
    ]
  },
  "links": {
    "evidence_bundle": "20260218T201956Z",
    "case": "IRB-875a6ecd",
    "findings": "FIND-3ce69932",
    "crosscheck": "CR-22f2d104",
    "receipts": [
      "RCPT-91d89f1f",
      "RCPT-d9328ae8",
      "RCPT-8fb14f8e"
    ]
  },
  "signals": {
    "provider_reliability": {
      "provider": "openrouter",
      "success_rate_1h": 1,
      "error_rate_1h": 0,
      "median_latency_ms": 459
    },
    "convergence": {
      "attempts": 1,
      "pass_rate": 1,
      "common_disagreements": []
    },
    "adverse_events": {
      "count": 0,
      "events": []
    }
  },
  "proposals": [
    {
      "id": "IRB-PROP-20260218-20-001",
      "title": "TBD (auto-generated placeholder) â€” propose a safe improvement backed by receipts",
      "holon": "Moats: Data & Learning Loops",
      "surface": "irb-sentinel",
      "risk": "GREEN",
      "why_now": "Hourly loop running; collect signals and propose bounded improvements.",
      "expected_impact": {
        "metric": "convergence.pass_rate",
        "direction": "up",
        "confidence": 0.5
      },
      "evidence": [
        {
          "ref": "receipts:RCPT-91d89f1f",
          "note": "See receipts for provider reliability."
        }
      ],
      "guardrails": [
        "No permissions/allowlists changes",
        "No network exposure changes",
        "No destructive ops",
        "No escalation routing changes"
      ],
      "next_action": "QUEUE_FOR_REVIEW"
    }
  ],
  "routing": {
    "forums": [
      {
        "name": "Advantage Forum",
        "reason": "learning loop consistency"
      },
      {
        "name": "Ethics Forum",
        "reason": "severity/escalation semantics"
      }
    ],
    "review_sla_hours": 72
  }
}
