{
  "schema": "meshcore.irb.improvement.v2",
  "run": {
    "job_id": "",
    "timestamp_utc": "2026-02-28T20:20:09Z",
    "commit_range": null,
    "forced": true,
    "irb_force": true,
    "irb_surfaces": [
      "governance",
      "ops-scripts"
    ],
    "sentinel_version": "v2"
  },
  "links": {
    "evidence_bundle": "20260228T201955Z",
    "case": "IRB-9cc77424",
    "findings": "FIND-0aaf75f1",
    "crosscheck": "CR-6efeafe9",
    "receipts": [
      "RCPT-f7039926",
      "RCPT-e67d8837",
      "RCPT-24dd266b"
    ]
  },
  "signals": {
    "provider_reliability": {
      "provider": "openrouter",
      "success_rate_1h": 1,
      "error_rate_1h": 0,
      "median_latency_ms": 441
    },
    "convergence": {
      "attempts": 1,
      "pass_rate": 1,
      "convergence_mode": "supermajority_2/3",
      "common_disagreements": [],
      "dissenters": [],
      "required_gates_aggregate": [
        "Evidence bundle verified, synthetic tag confirmed"
      ]
    },
    "adverse_events": {
      "count": 0,
      "events": []
    }
  },
  "proposals": [
    {
      "id": "IRB-PROP-20260228-20-001",
      "title": "Routine warm-up converged â€” no action required",
      "holon": "Moats: Data & Learning Loops",
      "surface": "irb-sentinel",
      "risk": "GREEN",
      "why_now": "Panel converged cleanly. System operating within expected parameters.",
      "expected_impact": {
        "metric": "convergence.pass_rate",
        "direction": "stable",
        "confidence": 0.9
      },
      "evidence": [
        {
          "ref": "receipts:RCPT-f7039926",
          "note": "All panel members agreed."
        }
      ],
      "guardrails": [
        "No permissions/allowlists changes",
        "No network exposure changes",
        "No destructive ops",
        "No escalation routing changes"
      ],
      "next_action": "NO_ACTION_REQUIRED"
    }
  ],
  "routing": {
    "forums": [],
    "review_sla_hours": 0
  }
}
